{
  "id": "550e8400-e29b-41d4-a716-446655440001",
  "title": "Conventional Commit Format",
  "content": {
    "problem": "Inconsistent commit messages make history hard to read and prevent automated changelog generation",
    "solution": "Use format: type(scope): description with standardized types",
    "implementation": "Install commitlint and husky: commitlint.config.js, package.json scripts",
    "whyValuable": "Enables automated changelogs, makes git history searchable, provides context for reviewers",
    "howToApply": "Add to any project with commitlint config and pre-commit hook"
  },
  "type": "workflow-rule",
  "category": "git",
  "tags": ["git", "workflow", "commit", "conventional-commits", "automation"],
  "source": {
    "type": "project-doc",
    "reference": "docs/GIT_WORKFLOW.md",
    "extractedDate": "2024-02-08T00:00:00Z"
  },
  "validation": "commitlint --edit passes on all commits",
  "applicableTo": ["web-app", "api-service", "cli-tool", "library", "documentation"],
  "maturity": "proven",
  "created": "2024-02-08T00:00:00Z",
  "updated": "2024-02-08T00:00:00Z"
}
